<?xml version="1.0" encoding="UTF-8"?>
<thuvien xmlns:xsi="http://www.w3.org/2001/XMLSchema-instance"
    xsi:noNamespaceSchemaLocation="thuvien.xsd">

    <!-- NHÀ XUẤT BẢN -->
    <nhaXuatBans>
        <nhaXuatBan id="NXB001">
            <tenNxb>Nhà xuất bản Văn học</tenNxb>
            <diaChi>18 Nguyễn Trường Tộ, Ba Đình, Hà Nội</diaChi>
            <sdt>2438222368</sdt>
        </nhaXuatBan>

        <nhaXuatBan id="NXB002">
            <tenNxb>Nhà xuất bản Giáo dục Việt Nam</tenNxb>
            <diaChi>81 Trần Hưng Đạo, Hoàn Kiếm, Hà Nội</diaChi>
            <sdt>2438220801</sdt>
        </nhaXuatBan>

        <nhaXuatBan id="NXB003">
            <tenNxb>Nhà xuất bản Kim Đồng</tenNxb>
            <diaChi>55 Quang Trung, Hai Bà Trưng, Hà Nội</diaChi>
            <sdt>2439434730</sdt>
        </nhaXuatBan>

        <nhaXuatBan id="NXB004">
            <tenNxb>Nhà xuất bản Trẻ</tenNxb>
            <diaChi>161B Lý Chính Thắng, Quận 3, TP.HCM</diaChi>
            <sdt>2839316211</sdt>
        </nhaXuatBan>

        <nhaXuatBan id="NXB005">
            <tenNxb>Nhà xuất bản Tổng hợp TPHCM</tenNxb>
            <diaChi>62 Nguyễn Thị Minh Khai, Quận 1, TP.HCM</diaChi>
            <sdt>2838225340</sdt>
        </nhaXuatBan>

        <nhaXuatBan id="NXB006">
            <tenNxb>Nhà xuất bản Lao Động</tenNxb>
            <diaChi>175 Giảng Võ, Đống Đa, Hà Nội</diaChi>
            <sdt>2438514496</sdt>
        </nhaXuatBan>

        <nhaXuatBan id="NXB007">
            <tenNxb>Nhà xuất bản Hội Nhà văn</tenNxb>
            <diaChi>65 Nguyễn Du, Hai Bà Trưng, Hà Nội</diaChi>
            <sdt>2439434470</sdt>
        </nhaXuatBan>

        <nhaXuatBan id="NXB008">
            <tenNxb>Nhà xuất bản Phụ nữ</tenNxb>
            <diaChi>39 Hàng Chuối, Hai Bà Trưng, Hà Nội</diaChi>
            <sdt>2439710717</sdt>
        </nhaXuatBan>

        <nhaXuatBan id="NXB009">
            <tenNxb>Nhà xuất bản Hà Nội</tenNxb>
            <diaChi>4 Tống Duy Tân, Hoàn Kiếm, Hà Nội</diaChi>
            <sdt>2439289143</sdt>
        </nhaXuatBan>

        <nhaXuatBan id="NXB010">
            <tenNxb>Nhà xuất bản Tri Thức</tenNxb>
            <diaChi>Tầng 7, Lô D20, ngõ 19 Duy Tân, Cầu Giấy, Hà Nội</diaChi>
            <sdt>2437562801</sdt>
        </nhaXuatBan>
    </nhaXuatBans>

    <!-- TÁC GIẢ -->
    <tacGias>
        <tacGia id="TG001">
            <tenTacGia>Nguyễn Du</tenTacGia>
            <ngaySinh>1766-01-03</ngaySinh>
        </tacGia>

        <tacGia id="TG002">
            <tenTacGia>Nam Cao</tenTacGia>
            <ngaySinh>1915-10-29</ngaySinh>
        </tacGia>

        <tacGia id="TG003">
            <tenTacGia>Ngô Tất Tố</tenTacGia>
            <ngaySinh>1894-10-25</ngaySinh>
        </tacGia>

        <tacGia id="TG004">
            <tenTacGia>Vũ Trọng Phụng</tenTacGia>
            <ngaySinh>1912-10-20</ngaySinh>
        </tacGia>

        <tacGia id="TG005">
            <tenTacGia>Nguyễn Nhật Ánh</tenTacGia>
            <ngaySinh>1955-05-07</ngaySinh>
        </tacGia>

        <tacGia id="TG006">
            <tenTacGia>Tô Hoài</tenTacGia>
            <ngaySinh>1920-09-27</ngaySinh>
        </tacGia>

        <tacGia id="TG007">
            <tenTacGia>Nguyễn Ngọc Tư</tenTacGia>
            <ngaySinh>1976-08-02</ngaySinh>
        </tacGia>

        <tacGia id="TG008">
            <tenTacGia>Nguyễn Huy Thiệp</tenTacGia>
            <ngaySinh>1950-04-29</ngaySinh>
        </tacGia>

        <tacGia id="TG009">
            <tenTacGia>Nguyễn Bình</tenTacGia>
            <ngaySinh>1918-06-15</ngaySinh>
        </tacGia>

        <tacGia id="TG010">
            <tenTacGia>Xuân Quỳnh</tenTacGia>
            <ngaySinh>1942-10-18</ngaySinh>
        </tacGia>

        <tacGia id="TG011">
            <tenTacGia>Tô Hoài</tenTacGia>
            <ngaySinh>1920-09-27</ngaySinh>
        </tacGia>

        <tacGia id="TG012">
            <tenTacGia>Nguyễn Tuân</tenTacGia>
            <ngaySinh>1910-07-15</ngaySinh>
        </tacGia>

        <tacGia id="TG013">
            <tenTacGia>Hồ Biểu Chánh</tenTacGia>
            <ngaySinh>1885-02-18</ngaySinh>
        </tacGia>

        <tacGia id="TG014">
            <tenTacGia>Thạch Lam</tenTacGia>
            <ngaySinh>1910-07-12</ngaySinh>
        </tacGia>

        <tacGia id="TG015">
            <tenTacGia>Nguyên Hồng</tenTacGia>
            <ngaySinh>1918-03-27</ngaySinh>
        </tacGia>

        <tacGia id="TG016">
            <tenTacGia>Dương Thu Hương</tenTacGia>
            <ngaySinh>1947-04-09</ngaySinh>
        </tacGia>

        <tacGia id="TG017">
            <tenTacGia>Trần Đăng Khoa</tenTacGia>
            <ngaySinh>1958-03-05</ngaySinh>
        </tacGia>

        <tacGia id="TG018">
            <tenTacGia>Trang Hạ</tenTacGia>
            <ngaySinh>1985-06-15</ngaySinh>
        </tacGia>

        <tacGia id="TG019">
            <tenTacGia>Anh Khang</tenTacGia>
            <ngaySinh>1982-11-22</ngaySinh>
        </tacGia>

        <tacGia id="TG020">
            <tenTacGia>Nguyễn Phong Việt</tenTacGia>
            <ngaySinh>1978-04-10</ngaySinh>
        </tacGia>

        <tacGia id="TG021">
            <tenTacGia>Tử Kim Liên</tenTacGia>
            <ngaySinh>1925-05-20</ngaySinh>
        </tacGia>

        <tacGia id="TG022">
            <tenTacGia>Sơn Nam</tenTacGia>
            <ngaySinh>1926-07-30</ngaySinh>
        </tacGia>

        <tacGia id="TG023">
            <tenTacGia>Bảo Ninh</tenTacGia>
            <ngaySinh>1952-10-18</ngaySinh>
        </tacGia>

        <tacGia id="TG024">
            <tenTacGia>Nguyễn Bắc Sơn</tenTacGia>
            <ngaySinh>1980-09-12</ngaySinh>
        </tacGia>

        <tacGia id="TG025">
            <tenTacGia>Nguyễn Ngọc Thạch</tenTacGia>
            <ngaySinh>1990-02-14</ngaySinh>
        </tacGia>

    </tacGias>

    <!-- THỂ LOẠI -->
    <theLoais>
        <theLoai id="TL001">
            <tenTheLoai>Tiểu thuyết</tenTheLoai>
        </theLoai>

        <theLoai id="TL002">
            <tenTheLoai>Truyện ngắn</tenTheLoai>
        </theLoai>

        <theLoai id="TL003">
            <tenTheLoai>Thơ ca</tenTheLoai>
        </theLoai>

        <theLoai id="TL004">
            <tenTheLoai>Văn học thiếu nhi</tenTheLoai>
        </theLoai>

        <theLoai id="TL005">
            <tenTheLoai>Văn học cổ điển</tenTheLoai>
        </theLoai>

        <theLoai id="TL006">
            <tenTheLoai>Văn học hiện đại</tenTheLoai>
        </theLoai>

        <theLoai id="TL007">
            <tenTheLoai>Ký</tenTheLoai>
        </theLoai>

        <theLoai id="TL008">
            <tenTheLoai>Triết lý</tenTheLoai>
        </theLoai>

    </theLoais>

    <!-- SÁCH (50 cuốn) -->
    <sachs>
        <sach id="S001">
            <tieuDe>Truyện Kiều</tieuDe>
            <nhaXuatBanRef>NXB001</nhaXuatBanRef>
            <tacGiaRef>TG001</tacGiaRef>
            <theLoaiRef>TL005</theLoaiRef>
            <nguoidungRef>ND001</nguoidungRef>
            <namXuatBan>2020</namXuatBan>
            <soLuong>15</soLuong>
            <tomTat>Tác phẩm trường ca bất hủ của Nguyễn Du kể về cuộc đời của Thuý Kiều, một người
                con
                gái tài sắc vẹn toàn nhưng phải trải qua nhiều nỗi buồn khổ vì số phận và hoàn cảnh
                xã
                hội.</tomTat>
        </sach>

        <sach id="S002">
            <tieuDe>Chí Phèo</tieuDe>
            <nhaXuatBanRef>NXB001</nhaXuatBanRef>
            <tacGiaRef>TG002</tacGiaRef>
            <theLoaiRef>TL002</theLoaiRef>
            <nguoidungRef>ND001</nguoidungRef>
            <namXuatBan>2019</namXuatBan>
            <soLuong>20</soLuong>
            <tomTat>Truyện ngắn nổi tiếng của Nam Cao về cuộc đời Chí Phèo, một con người bị xã hội
                đẩy
                đến con đường sa đọa, thể hiện sự phê phán sâu sắc về xã hội nửa phong kiến nửa thực
                dân.</tomTat>
        </sach>

        <sach id="S003">
            <tieuDe>Tắt Đèn</tieuDe>
            <nhaXuatBanRef>NXB001</nhaXuatBanRef>
            <tacGiaRef>TG003</tacGiaRef>
            <theLoaiRef>TL001</theLoaiRef>
            <nguoidungRef>ND001</nguoidungRef>
            <namXuatBan>2018</namXuatBan>
            <soLuong>18</soLuong>
            <tomTat>Tiểu thuyết kinh điển của Ngô Tất Tố phản ánh cuộc sống cùng cực của nông dân
                Việt
                Nam dưới ách thống trị của thực dân Pháp qua gia đình chị Dậu và Dậu.</tomTat>
        </sach>

        <sach id="S004">
            <tieuDe>Số Đỏ</tieuDe>
            <nhaXuatBanRef>NXB007</nhaXuatBanRef>
            <tacGiaRef>TG004</tacGiaRef>
            <theLoaiRef>TL001</theLoaiRef>
            <nguoidungRef>ND001</nguoidungRef>
            <namXuatBan>2020</namXuatBan>
            <soLuong>12</soLuong>
            <tomTat>Tiểu thuyết châm biếm của Vũ Trọng Phụng kể về cuộc đời Xuân Tóc Đỏ, một tên vô
                lại
                may mắn được thăng tiến nhờ khôn khéo và lịch lãm, phê phán xã hội cũ.</tomTat>
        </sach>

        <sach id="S005">
            <tieuDe>Mắt Biếc</tieuDe>
            <nhaXuatBanRef>NXB004</nhaXuatBanRef>
            <tacGiaRef>TG005</tacGiaRef>
            <theLoaiRef>TL001</theLoaiRef>
            <nguoidungRef>ND001</nguoidungRef>
            <namXuatBan>2021</namXuatBan>
            <soLuong>25</soLuong>
            <tomTat>Câu chuyện tình đầu trong sáng và day dứt của Ngạn với cô bé Hà Lan mắt biếc,
                một
                tác phẩm đầy cảm xúc về tuổi thơ và tình yêu của Nguyễn Nhật Ánh.</tomTat>
        </sach>

        <sach id="S006">
            <tieuDe>Tôi Thấy Hoa Vàng Trên Cỏ Xanh</tieuDe>
            <nhaXuatBanRef>NXB004</nhaXuatBanRef>
            <tacGiaRef>TG005</tacGiaRef>
            <theLoaiRef>TL001</theLoaiRef>
            <nguoidungRef>ND001</nguoidungRef>
            <namXuatBan>2022</namXuatBan>
            <soLuong>30</soLuong>
            <tomTat>Truyện kể về tuổi thơ nghèo khó nhưng đẹp đẽ của hai anh em Thiều và Tường ở
                miền